GEO.id,GEO.id2,GEO.display-label,HC01_EST_VC01,HC01_MOE_VC01,HC02_EST_VC01,HC02_MOE_VC01,HC03_EST_VC01,HC03_MOE_VC01,HC01_EST_VC03,HC01_MOE_VC03,HC02_EST_VC03,HC02_MOE_VC03,HC03_EST_VC03,HC03_MOE_VC03,HC01_EST_VC04,HC01_MOE_VC04,HC02_EST_VC04,HC02_MOE_VC04,HC03_EST_VC04,HC03_MOE_VC04,HC01_EST_VC05,HC01_MOE_VC05,HC02_EST_VC05,HC02_MOE_VC05,HC03_EST_VC05,HC03_MOE_VC05,HC01_EST_VC06,HC01_MOE_VC06,HC02_EST_VC06,HC02_MOE_VC06,HC03_EST_VC06,HC03_MOE_VC06,HC01_EST_VC07,HC01_MOE_VC07,HC02_EST_VC07,HC02_MOE_VC07,HC03_EST_VC07,HC03_MOE_VC07,HC01_EST_VC08,HC01_MOE_VC08,HC02_EST_VC08,HC02_MOE_VC08,HC03_EST_VC08,HC03_MOE_VC08,HC01_EST_VC09,HC01_MOE_VC09,HC02_EST_VC09,HC02_MOE_VC09,HC03_EST_VC09,HC03_MOE_VC09,HC01_EST_VC10,HC01_MOE_VC10,HC02_EST_VC10,HC02_MOE_VC10,HC03_EST_VC10,HC03_MOE_VC10,HC01_EST_VC11,HC01_MOE_VC11,HC02_EST_VC11,HC02_MOE_VC11,HC03_EST_VC11,HC03_MOE_VC11,HC01_EST_VC12,HC01_MOE_VC12,HC02_EST_VC12,HC02_MOE_VC12,HC03_EST_VC12,HC03_MOE_VC12,HC01_EST_VC13,HC01_MOE_VC13,HC02_EST_VC13,HC02_MOE_VC13,HC03_EST_VC13,HC03_MOE_VC13,HC01_EST_VC14,HC01_MOE_VC14,HC02_EST_VC14,HC02_MOE_VC14,HC03_EST_VC14,HC03_MOE_VC14,HC01_EST_VC15,HC01_MOE_VC15,HC02_EST_VC15,HC02_MOE_VC15,HC03_EST_VC15,HC03_MOE_VC15,HC01_EST_VC16,HC01_MOE_VC16,HC02_EST_VC16,HC02_MOE_VC16,HC03_EST_VC16,HC03_MOE_VC16,HC01_EST_VC17,HC01_MOE_VC17,HC02_EST_VC17,HC02_MOE_VC17,HC03_EST_VC17,HC03_MOE_VC17,HC01_EST_VC18,HC01_MOE_VC18,HC02_EST_VC18,HC02_MOE_VC18,HC03_EST_VC18,HC03_MOE_VC18,HC01_EST_VC19,HC01_MOE_VC19,HC02_EST_VC19,HC02_MOE_VC19,HC03_EST_VC19,HC03_MOE_VC19,HC01_EST_VC20,HC01_MOE_VC20,HC02_EST_VC20,HC02_MOE_VC20,HC03_EST_VC20,HC03_MOE_VC20,HC01_EST_VC22,HC01_MOE_VC22,HC02_EST_VC22,HC02_MOE_VC22,HC03_EST_VC22,HC03_MOE_VC22,HC01_EST_VC23,HC01_MOE_VC23,HC02_EST_VC23,HC02_MOE_VC23,HC03_EST_VC23,HC03_MOE_VC23,HC01_EST_VC24,HC01_MOE_VC24,HC02_EST_VC24,HC02_MOE_VC24,HC03_EST_VC24,HC03_MOE_VC24,HC01_EST_VC25,HC01_MOE_VC25,HC02_EST_VC25,HC02_MOE_VC25,HC03_EST_VC25,HC03_MOE_VC25,HC01_EST_VC26,HC01_MOE_VC26,HC02_EST_VC26,HC02_MOE_VC26,HC03_EST_VC26,HC03_MOE_VC26,HC01_EST_VC27,HC01_MOE_VC27,HC02_EST_VC27,HC02_MOE_VC27,HC03_EST_VC27,HC03_MOE_VC27,HC01_EST_VC28,HC01_MOE_VC28,HC02_EST_VC28,HC02_MOE_VC28,HC03_EST_VC28,HC03_MOE_VC28,HC01_EST_VC29,HC01_MOE_VC29,HC02_EST_VC29,HC02_MOE_VC29,HC03_EST_VC29,HC03_MOE_VC29,HC01_EST_VC30,HC01_MOE_VC30,HC02_EST_VC30,HC02_MOE_VC30,HC03_EST_VC30,HC03_MOE_VC30,HC01_EST_VC31,HC01_MOE_VC31,HC02_EST_VC31,HC02_MOE_VC31,HC03_EST_VC31,HC03_MOE_VC31,HC01_EST_VC33,HC01_MOE_VC33,HC02_EST_VC33,HC02_MOE_VC33,HC03_EST_VC33,HC03_MOE_VC33,HC01_EST_VC34,HC01_MOE_VC34,HC02_EST_VC34,HC02_MOE_VC34,HC03_EST_VC34,HC03_MOE_VC34,HC01_EST_VC35,HC01_MOE_VC35,HC02_EST_VC35,HC02_MOE_VC35,HC03_EST_VC35,HC03_MOE_VC35,HC01_EST_VC36,HC01_MOE_VC36,HC02_EST_VC36,HC02_MOE_VC36,HC03_EST_VC36,HC03_MOE_VC36,HC01_EST_VC37,HC01_MOE_VC37,HC02_EST_VC37,HC02_MOE_VC37,HC03_EST_VC37,HC03_MOE_VC37,HC01_EST_VC39,HC01_MOE_VC39,HC02_EST_VC39,HC02_MOE_VC39,HC03_EST_VC39,HC03_MOE_VC39,HC01_EST_VC40,HC01_MOE_VC40,HC02_EST_VC40,HC02_MOE_VC40,HC03_EST_VC40,HC03_MOE_VC40
Id,Id2,Geography,Total; Estimate; Total population,Total; Margin of Error; Total population,Male; Estimate; Total population,Male; Margin of Error; Total population,Female; Estimate; Total population,Female; Margin of Error; Total population,Total; Estimate; Total population - AGE - Under 5 years,Total; Margin of Error; Total population - AGE - Under 5 years,Male; Estimate; Total population - AGE - Under 5 years,Male; Margin of Error; Total population - AGE - Under 5 years,Female; Estimate; Total population - AGE - Under 5 years,Female; Margin of Error; Total population - AGE - Under 5 years,Total; Estimate; Total population - AGE - 5 to 9 years,Total; Margin of Error; Total population - AGE - 5 to 9 years,Male; Estimate; Total population - AGE - 5 to 9 years,Male; Margin of Error; Total population - AGE - 5 to 9 years,Female; Estimate; Total population - AGE - 5 to 9 years,Female; Margin of Error; Total population - AGE - 5 to 9 years,Total; Estimate; Total population - AGE - 10 to 14 years,Total; Margin of Error; Total population - AGE - 10 to 14 years,Male; Estimate; Total population - AGE - 10 to 14 years,Male; Margin of Error; Total population - AGE - 10 to 14 years,Female; Estimate; Total population - AGE - 10 to 14 years,Female; Margin of Error; Total population - AGE - 10 to 14 years,Total; Estimate; Total population - AGE - 15 to 19 years,Total; Margin of Error; Total population - AGE - 15 to 19 years,Male; Estimate; Total population - AGE - 15 to 19 years,Male; Margin of Error; Total population - AGE - 15 to 19 years,Female; Estimate; Total population - AGE - 15 to 19 years,Female; Margin of Error; Total population - AGE - 15 to 19 years,Total; Estimate; Total population - AGE - 20 to 24 years,Total; Margin of Error; Total population - AGE - 20 to 24 years,Male; Estimate; Total population - AGE - 20 to 24 years,Male; Margin of Error; Total population - AGE - 20 to 24 years,Female; Estimate; Total population - AGE - 20 to 24 years,Female; Margin of Error; Total population - AGE - 20 to 24 years,Total; Estimate; Total population - AGE - 25 to 29 years,Total; Margin of Error; Total population - AGE - 25 to 29 years,Male; Estimate; Total population - AGE - 25 to 29 years,Male; Margin of Error; Total population - AGE - 25 to 29 years,Female; Estimate; Total population - AGE - 25 to 29 years,Female; Margin of Error; Total population - AGE - 25 to 29 years,Total; Estimate; Total population - AGE - 30 to 34 years,Total; Margin of Error; Total population - AGE - 30 to 34 years,Male; Estimate; Total population - AGE - 30 to 34 years,Male; Margin of Error; Total population - AGE - 30 to 34 years,Female; Estimate; Total population - AGE - 30 to 34 years,Female; Margin of Error; Total population - AGE - 30 to 34 years,Total; Estimate; Total population - AGE - 35 to 39 years,Total; Margin of Error; Total population - AGE - 35 to 39 years,Male; Estimate; Total population - AGE - 35 to 39 years,Male; Margin of Error; Total population - AGE - 35 to 39 years,Female; Estimate; Total population - AGE - 35 to 39 years,Female; Margin of Error; Total population - AGE - 35 to 39 years,Total; Estimate; Total population - AGE - 40 to 44 years,Total; Margin of Error; Total population - AGE - 40 to 44 years,Male; Estimate; Total population - AGE - 40 to 44 years,Male; Margin of Error; Total population - AGE - 40 to 44 years,Female; Estimate; Total population - AGE - 40 to 44 years,Female; Margin of Error; Total population - AGE - 40 to 44 years,Total; Estimate; Total population - AGE - 45 to 49 years,Total; Margin of Error; Total population - AGE - 45 to 49 years,Male; Estimate; Total population - AGE - 45 to 49 years,Male; Margin of Error; Total population - AGE - 45 to 49 years,Female; Estimate; Total population - AGE - 45 to 49 years,Female; Margin of Error; Total population - AGE - 45 to 49 years,Total; Estimate; Total population - AGE - 50 to 54 years,Total; Margin of Error; Total population - AGE - 50 to 54 years,Male; Estimate; Total population - AGE - 50 to 54 years,Male; Margin of Error; Total population - AGE - 50 to 54 years,Female; Estimate; Total population - AGE - 50 to 54 years,Female; Margin of Error; Total population - AGE - 50 to 54 years,Total; Estimate; Total population - AGE - 55 to 59 years,Total; Margin of Error; Total population - AGE - 55 to 59 years,Male; Estimate; Total population - AGE - 55 to 59 years,Male; Margin of Error; Total population - AGE - 55 to 59 years,Female; Estimate; Total population - AGE - 55 to 59 years,Female; Margin of Error; Total population - AGE - 55 to 59 years,Total; Estimate; Total population - AGE - 60 to 64 years,Total; Margin of Error; Total population - AGE - 60 to 64 years,Male; Estimate; Total population - AGE - 60 to 64 years,Male; Margin of Error; Total population - AGE - 60 to 64 years,Female; Estimate; Total population - AGE - 60 to 64 years,Female; Margin of Error; Total population - AGE - 60 to 64 years,Total; Estimate; Total population - AGE - 65 to 69 years,Total; Margin of Error; Total population - AGE - 65 to 69 years,Male; Estimate; Total population - AGE - 65 to 69 years,Male; Margin of Error; Total population - AGE - 65 to 69 years,Female; Estimate; Total population - AGE - 65 to 69 years,Female; Margin of Error; Total population - AGE - 65 to 69 years,Total; Estimate; Total population - AGE - 70 to 74 years,Total; Margin of Error; Total population - AGE - 70 to 74 years,Male; Estimate; Total population - AGE - 70 to 74 years,Male; Margin of Error; Total population - AGE - 70 to 74 years,Female; Estimate; Total population - AGE - 70 to 74 years,Female; Margin of Error; Total population - AGE - 70 to 74 years,Total; Estimate; Total population - AGE - 75 to 79 years,Total; Margin of Error; Total population - AGE - 75 to 79 years,Male; Estimate; Total population - AGE - 75 to 79 years,Male; Margin of Error; Total population - AGE - 75 to 79 years,Female; Estimate; Total population - AGE - 75 to 79 years,Female; Margin of Error; Total population - AGE - 75 to 79 years,Total; Estimate; Total population - AGE - 80 to 84 years,Total; Margin of Error; Total population - AGE - 80 to 84 years,Male; Estimate; Total population - AGE - 80 to 84 years,Male; Margin of Error; Total population - AGE - 80 to 84 years,Female; Estimate; Total population - AGE - 80 to 84 years,Female; Margin of Error; Total population - AGE - 80 to 84 years,Total; Estimate; Total population - AGE - 85 years and over,Total; Margin of Error; Total population - AGE - 85 years and over,Male; Estimate; Total population - AGE - 85 years and over,Male; Margin of Error; Total population - AGE - 85 years and over,Female; Estimate; Total population - AGE - 85 years and over,Female; Margin of Error; Total population - AGE - 85 years and over,Total; Estimate; Total population - SELECTED AGE CATEGORIES - 5 to 14 years,Total; Margin of Error; Total population - SELECTED AGE CATEGORIES - 5 to 14 years,Male; Estimate; Total population - SELECTED AGE CATEGORIES - 5 to 14 years,Male; Margin of Error; Total population - SELECTED AGE CATEGORIES - 5 to 14 years,Female; Estimate; Total population - SELECTED AGE CATEGORIES - 5 to 14 years,Female; Margin of Error; Total population - SELECTED AGE CATEGORIES - 5 to 14 years,Total; Estimate; Total population - SELECTED AGE CATEGORIES - 15 to 17 years,Total; Margin of Error; Total population - SELECTED AGE CATEGORIES - 15 to 17 years,Male; Estimate; Total population - SELECTED AGE CATEGORIES - 15 to 17 years,Male; Margin of Error; Total population - SELECTED AGE CATEGORIES - 15 to 17 years,Female; Estimate; Total population - SELECTED AGE CATEGORIES - 15 to 17 years,Female; Margin of Error; Total population - SELECTED AGE CATEGORIES - 15 to 17 years,Total; Estimate; Total population - SELECTED AGE CATEGORIES - 18 to 24 years,Total; Margin of Error; Total population - SELECTED AGE CATEGORIES - 18 to 24 years,Male; Estimate; Total population - SELECTED AGE CATEGORIES - 18 to 24 years,Male; Margin of Error; Total population - SELECTED AGE CATEGORIES - 18 to 24 years,Female; Estimate; Total population - SELECTED AGE CATEGORIES - 18 to 24 years,Female; Margin of Error; Total population - SELECTED AGE CATEGORIES - 18 to 24 years,Total; Estimate; Total population - SELECTED AGE CATEGORIES - 15 to 44 years,Total; Margin of Error; Total population - SELECTED AGE CATEGORIES - 15 to 44 years,Male; Estimate; Total population - SELECTED AGE CATEGORIES - 15 to 44 years,Male; Margin of Error; Total population - SELECTED AGE CATEGORIES - 15 to 44 years,Female; Estimate; Total population - SELECTED AGE CATEGORIES - 15 to 44 years,Female; Margin of Error; Total population - SELECTED AGE CATEGORIES - 15 to 44 years,Total; Estimate; Total population - SELECTED AGE CATEGORIES - 16 years and over,Total; Margin of Error; Total population - SELECTED AGE CATEGORIES - 16 years and over,Male; Estimate; Total population - SELECTED AGE CATEGORIES - 16 years and over,Male; Margin of Error; Total population - SELECTED AGE CATEGORIES - 16 years and over,Female; Estimate; Total population - SELECTED AGE CATEGORIES - 16 years and over,Female; Margin of Error; Total population - SELECTED AGE CATEGORIES - 16 years and over,Total; Estimate; Total population - SELECTED AGE CATEGORIES - 18 years and over,Total; Margin of Error; Total population - SELECTED AGE CATEGORIES - 18 years and over,Male; Estimate; Total population - SELECTED AGE CATEGORIES - 18 years and over,Male; Margin of Error; Total population - SELECTED AGE CATEGORIES - 18 years and over,Female; Estimate; Total population - SELECTED AGE CATEGORIES - 18 years and over,Female; Margin of Error; Total population - SELECTED AGE CATEGORIES - 18 years and over,Total; Estimate; Total population - SELECTED AGE CATEGORIES - 60 years and over,Total; Margin of Error; Total population - SELECTED AGE CATEGORIES - 60 years and over,Male; Estimate; Total population - SELECTED AGE CATEGORIES - 60 years and over,Male; Margin of Error; Total population - SELECTED AGE CATEGORIES - 60 years and over,Female; Estimate; Total population - SELECTED AGE CATEGORIES - 60 years and over,Female; Margin of Error; Total population - SELECTED AGE CATEGORIES - 60 years and over,Total; Estimate; Total population - SELECTED AGE CATEGORIES - 62 years and over,Total; Margin of Error; Total population - SELECTED AGE CATEGORIES - 62 years and over,Male; Estimate; Total population - SELECTED AGE CATEGORIES - 62 years and over,Male; Margin of Error; Total population - SELECTED AGE CATEGORIES - 62 years and over,Female; Estimate; Total population - SELECTED AGE CATEGORIES - 62 years and over,Female; Margin of Error; Total population - SELECTED AGE CATEGORIES - 62 years and over,Total; Estimate; Total population - SELECTED AGE CATEGORIES - 65 years and over,Total; Margin of Error; Total population - SELECTED AGE CATEGORIES - 65 years and over,Male; Estimate; Total population - SELECTED AGE CATEGORIES - 65 years and over,Male; Margin of Error; Total population - SELECTED AGE CATEGORIES - 65 years and over,Female; Estimate; Total population - SELECTED AGE CATEGORIES - 65 years and over,Female; Margin of Error; Total population - SELECTED AGE CATEGORIES - 65 years and over,Total; Estimate; Total population - SELECTED AGE CATEGORIES - 75 years and over,Total; Margin of Error; Total population - SELECTED AGE CATEGORIES - 75 years and over,Male; Estimate; Total population - SELECTED AGE CATEGORIES - 75 years and over,Male; Margin of Error; Total population - SELECTED AGE CATEGORIES - 75 years and over,Female; Estimate; Total population - SELECTED AGE CATEGORIES - 75 years and over,Female; Margin of Error; Total population - SELECTED AGE CATEGORIES - 75 years and over,Total; Estimate; Total population - SUMMARY INDICATORS - Median age (years),Total; Margin of Error; Total population - SUMMARY INDICATORS - Median age (years),Male; Estimate; Total population - SUMMARY INDICATORS - Median age (years),Male; Margin of Error; Total population - SUMMARY INDICATORS - Median age (years),Female; Estimate; Total population - SUMMARY INDICATORS - Median age (years),Female; Margin of Error; Total population - SUMMARY INDICATORS - Median age (years),Total; Estimate; Total population - SUMMARY INDICATORS - Sex ratio (males per 100 females),Total; Margin of Error; Total population - SUMMARY INDICATORS - Sex ratio (males per 100 females),Male; Estimate; Total population - SUMMARY INDICATORS - Sex ratio (males per 100 females),Male; Margin of Error; Total population - SUMMARY INDICATORS - Sex ratio (males per 100 females),Female; Estimate; Total population - SUMMARY INDICATORS - Sex ratio (males per 100 females),Female; Margin of Error; Total population - SUMMARY INDICATORS - Sex ratio (males per 100 females),Total; Estimate; Total population - SUMMARY INDICATORS - Age dependency ratio,Total; Margin of Error; Total population - SUMMARY INDICATORS - Age dependency ratio,Male; Estimate; Total population - SUMMARY INDICATORS - Age dependency ratio,Male; Margin of Error; Total population - SUMMARY INDICATORS - Age dependency ratio,Female; Estimate; Total population - SUMMARY INDICATORS - Age dependency ratio,Female; Margin of Error; Total population - SUMMARY INDICATORS - Age dependency ratio,Total; Estimate; Total population - SUMMARY INDICATORS - Old-age dependency ratio,Total; Margin of Error; Total population - SUMMARY INDICATORS - Old-age dependency ratio,Male; Estimate; Total population - SUMMARY INDICATORS - Old-age dependency ratio,Male; Margin of Error; Total population - SUMMARY INDICATORS - Old-age dependency ratio,Female; Estimate; Total population - SUMMARY INDICATORS - Old-age dependency ratio,Female; Margin of Error; Total population - SUMMARY INDICATORS - Old-age dependency ratio,Total; Estimate; Total population - SUMMARY INDICATORS - Child dependency ratio,Total; Margin of Error; Total population - SUMMARY INDICATORS - Child dependency ratio,Male; Estimate; Total population - SUMMARY INDICATORS - Child dependency ratio,Male; Margin of Error; Total population - SUMMARY INDICATORS - Child dependency ratio,Female; Estimate; Total population - SUMMARY INDICATORS - Child dependency ratio,Female; Margin of Error; Total population - SUMMARY INDICATORS - Child dependency ratio,Total; Estimate; Total population - PERCENT IMPUTED - Sex,Total; Margin of Error; Total population - PERCENT IMPUTED - Sex,Male; Estimate; Total population - PERCENT IMPUTED - Sex,Male; Margin of Error; Total population - PERCENT IMPUTED - Sex,Female; Estimate; Total population - PERCENT IMPUTED - Sex,Female; Margin of Error; Total population - PERCENT IMPUTED - Sex,Total; Estimate; Total population - PERCENT IMPUTED - Age,Total; Margin of Error; Total population - PERCENT IMPUTED - Age,Male; Estimate; Total population - PERCENT IMPUTED - Age,Male; Margin of Error; Total population - PERCENT IMPUTED - Age,Female; Estimate; Total population - PERCENT IMPUTED - Age,Female; Margin of Error; Total population - PERCENT IMPUTED - Age
1400000US06073000100,06073000100,"Census Tract 1, San Diego County, California",3165,360,1507,163,1658,282,5.8,4.6,4.8,3.6,6.8,8.2,9.2,2.5,12.7,4.3,6.0,3.1,4.8,1.9,3.1,2.2,6.5,2.7,2.1,1.6,2.5,2.3,1.7,1.9,1.0,1.1,0.9,1.5,1.1,1.6,3.7,2.7,3.8,4.2,3.6,2.7,1.6,1.2,2.3,2.2,1.1,1.4,8.5,3.9,8.9,4.7,8.1,4.8,5.6,2.3,3.3,2.4,7.7,3.4,8.5,2.4,5.9,4.1,10.9,3.9,10.5,2.5,12.6,5.9,8.6,4.3,9.0,3.0,7.4,3.5,10.4,5.3,9.5,3.4,12.5,5.3,6.8,3.3,5.0,2.3,3.8,2.9,6.0,3.0,3.8,1.6,4.0,2.5,3.6,2.5,2.7,1.6,3.6,2.4,2.0,1.8,4.3,2.1,4.7,3.0,3.9,2.7,4.2,2.2,3.1,2.6,5.2,3.9,14.0,3.0,15.7,4.4,12.5,4.0,1.2,1.1,0.7,1.3,1.7,1.9,1.9,1.5,2.7,2.6,1.1,1.6,22.5,4.1,21.7,5.5,23.2,5.0,79.4,5.3,78.7,4.5,80.0,10.0,78.9,5.1,78.7,4.5,79.1,9.7,29.6,4.7,31.8,5.8,27.6,6.2,24.5,3.5,24.3,4.6,24.6,5.5,20.1,2.6,19.3,3.6,20.8,4.8,11.3,2.8,11.4,3.6,11.2,4.4,48.8,5.0,51.1,5.1,47.8,5.9,90.9,16.6,(X),(X),(X),(X),70.1,11.9,(X),(X),(X),(X),34.2,4.7,(X),(X),(X),(X),35.9,10.9,(X),(X),(X),(X),0.0,(X),(X),(X),(X),(X),0.0,(X),(X),(X),(X),(X)
1400000US06073000200,06073000200,"Census Tract 2, San Diego County, California",6117,370,3125,231,2992,338,5.2,2.3,5.4,4.1,5.1,2.9,3.0,1.7,3.8,2.7,2.2,1.6,2.7,1.1,2.9,1.5,2.5,1.9,2.2,1.2,2.6,1.7,1.8,1.6,6.0,3.1,3.5,2.6,8.7,4.7,10.5,3.8,7.9,4.4,13.2,4.6,10.1,3.0,9.6,4.2,10.5,4.1,8.2,2.4,5.9,2.8,10.6,4.1,8.6,2.8,11.8,4.3,5.3,2.6,9.5,2.7,14.2,4.8,4.5,2.9,7.3,2.2,8.3,3.7,6.2,2.4,5.4,1.7,4.8,2.1,5.9,2.6,4.1,1.9,4.3,2.6,4.0,2.5,4.8,1.6,6.3,2.6,3.1,2.2,2.6,1.4,1.8,1.6,3.3,2.1,2.8,1.6,2.8,1.8,2.7,1.9,4.0,2.1,3.3,2.4,4.7,3.2,3.1,2.2,0.7,0.9,5.5,3.8,5.7,1.6,6.7,2.8,4.7,2.1,1.4,0.9,1.8,1.3,1.0,1.2,6.8,3.1,4.3,2.9,9.5,4.6,45.6,3.7,41.3,5.6,50.2,6.0,88.6,2.0,87.0,3.7,90.2,2.8,87.7,1.8,86.1,3.6,89.3,2.9,21.3,2.9,19.3,3.3,23.4,5.3,19.1,3.1,16.7,3.2,21.5,5.4,17.2,3.4,15.0,3.2,19.4,5.8,9.8,3.8,6.9,3.2,12.9,5.7,41.3,2.4,43.7,2.8,38.2,2.5,104.4,15.3,(X),(X),(X),(X),41.9,7.6,(X),(X),(X),(X),24.4,6.0,(X),(X),(X),(X),17.5,3.1,(X),(X),(X),(X),0.0,(X),(X),(X),(X),(X),0.9,(X),(X),(X),(X),(X)
1400000US06073000300,06073000300,"Census Tract 3, San Diego County, California",5279,488,2499,339,2780,396,2.6,2.4,3.4,3.7,1.9,2.0,0.9,1.1,0.7,1.2,1.1,1.8,0.6,0.8,1.2,1.7,0.0,1.4,2.1,1.7,2.3,2.1,2.0,1.9,5.5,2.6,1.8,1.8,8.9,5.0,14.2,3.7,8.2,4.0,19.7,6.0,10.2,3.1,12.5,5.2,8.1,3.4,8.6,3.0,9.9,5.5,7.5,3.3,9.2,3.6,11.4,4.9,7.2,4.2,5.4,2.6,6.0,3.1,4.8,3.5,7.1,3.5,7.3,4.8,7.0,4.8,6.1,2.4,8.0,3.6,4.4,3.5,5.9,2.5,4.8,2.9,6.8,4.1,4.1,2.3,5.2,3.2,3.2,3.2,4.3,1.8,5.0,2.4,3.7,2.4,4.4,1.7,5.3,2.6,3.6,2.0,6.7,2.8,6.0,4.2,7.3,3.4,1.9,1.2,1.0,0.9,2.8,2.3,1.5,1.3,2.0,1.8,1.1,1.8,1.0,1.4,1.0,1.5,0.9,1.4,6.7,2.6,3.0,2.4,9.9,5.1,49.9,4.3,46.0,5.5,53.4,5.5,95.4,2.4,94.6,3.6,96.0,2.8,94.9,2.5,93.6,3.5,96.0,2.8,27.4,5.1,27.3,5.8,27.4,7.0,23.3,4.3,24.7,5.5,22.0,6.2,21.5,4.1,22.5,5.0,20.6,5.8,13.0,3.4,12.3,4.7,13.7,4.3,43.3,2.4,44.4,4.6,41.0,7.6,89.9,18.9,(X),(X),(X),(X),36.3,7.6,(X),(X),(X),(X),29.3,6.9,(X),(X),(X),(X),7.0,3.5,(X),(X),(X),(X),0.0,(X),(X),(X),(X),(X),0.2,(X),(X),(X),(X),(X)
1400000US06073000400,06073000400,"Census Tract 4, San Diego County, California",3401,260,1905,209,1496,191,0.4,0.7,0.0,2.1,1.0,1.7,1.1,1.6,0.0,2.1,2.5,3.5,0.0,1.2,0.0,2.1,0.0,2.6,0.0,1.2,0.0,2.1,0.0,2.6,6.6,3.5,3.5,3.5,10.6,6.4,23.1,4.1,20.9,4.9,25.9,8.1,16.2,4.4,17.3,5.4,14.8,7.0,12.2,4.5,14.9,7.1,8.7,4.1,2.9,1.9,4.6,3.2,0.7,1.1,12.7,6.5,10.6,6.2,15.4,8.0,5.1,2.3,6.6,3.2,3.1,2.8,6.7,4.3,9.6,6.8,2.9,4.1,5.7,3.2,6.1,4.8,5.2,4.2,2.0,1.8,2.8,2.8,0.9,1.6,0.0,1.2,0.0,2.1,0.0,2.6,2.8,1.7,0.6,1.1,5.6,4.0,1.7,1.1,1.7,2.0,1.7,2.0,0.8,0.9,0.6,1.0,0.9,1.5,1.1,1.6,0.0,2.1,2.5,3.5,0.0,1.2,0.0,2.1,0.0,2.6,6.6,3.5,3.5,3.5,10.6,6.4,61.0,4.8,61.3,5.1,60.6,9.3,98.4,2.0,100.0,2.1,96.5,4.4,98.4,2.0,100.0,2.1,96.5,4.4,13.0,3.1,12.0,4.4,14.3,4.5,10.2,2.4,9.3,3.0,11.2,4.0,7.3,1.5,5.8,2.3,9.1,3.8,5.3,2.2,3.0,2.3,8.2,3.9,36.2,2.2,38.4,2.4,32.6,3.0,127.3,23.3,(X),(X),(X),(X),9.7,2.5,(X),(X),(X),(X),8.0,1.7,(X),(X),(X),(X),1.7,2.2,(X),(X),(X),(X),0.0,(X),(X),(X),(X),(X),1.7,(X),(X),(X),(X),(X)
1400000US06073000500,06073000500,"Census Tract 5, San Diego County, California",2727,272,1477,210,1250,171,3.4,2.3,5.6,3.9,0.8,1.3,0.6,0.9,0.0,2.7,1.2,2.0,4.2,2.2,4.8,3.1,3.5,3.0,0.0,1.5,0.0,2.7,0.0,3.1,3.8,1.9,3.1,2.4,4.6,3.2,12.6,4.3,7.9,4.0,18.2,7.2,13.3,3.6,14.4,5.4,12.0,4.7,10.3,3.1,10.0,4.3,10.7,6.5,8.3,4.3,12.3,8.2,3.6,3.3,12.5,4.7,15.2,7.1,9.3,5.3,9.0,4.1,9.5,6.2,8.5,5.7,6.6,3.4,3.3,2.4,10.5,6.6,6.5,2.6,6.5,3.8,6.5,3.6,1.2,1.1,1.7,2.0,0.6,1.0,2.4,1.7,2.2,2.0,2.6,2.4,2.2,1.6,0.7,1.1,4.1,3.3,1.6,1.1,1.5,1.3,1.7,1.8,1.5,1.1,1.4,1.5,1.6,1.8,4.8,2.0,4.8,3.1,4.7,2.7,0.0,1.5,0.0,2.7,0.0,3.1,3.8,1.9,3.1,2.4,4.6,3.2,48.4,6.5,47.7,9.4,49.1,7.1,91.9,2.2,89.6,3.9,94.5,3.0,91.9,2.2,89.6,3.9,94.5,3.0,15.4,3.8,13.9,4.7,17.1,5.6,11.6,2.9,11.4,3.7,11.9,4.5,8.9,2.5,7.4,2.8,10.6,4.1,5.3,2.2,3.6,2.2,7.4,3.7,40.4,2.2,40.5,2.5,39.1,8.2,118.2,23.4,(X),(X),(X),(X),20.6,5.2,(X),(X),(X),(X),10.7,3.4,(X),(X),(X),(X),9.8,3.0,(X),(X),(X),(X),0.0,(X),(X),(X),(X),(X),0.0,(X),(X),(X),(X),(X)
1400000US06073000600,06073000600,"Census Tract 6, San Diego County, California",2929,380,1469,138,1460,377,2.4,1.7,2.9,2.8,1.8,1.8,2.0,1.8,1.0,1.5,2.9,2.8,0.6,0.9,1.1,1.3,0.1,0.8,1.0,1.2,0.7,1.1,1.4,2.0,7.3,4.5,1.3,1.7,13.4,7.7,10.4,3.4,10.3,5.0,10.5,4.0,12.7,3.6,9.5,4.6,15.9,5.5,12.1,4.1,18.7,6.9,5.5,3.6,9.5,2.8,14.3,5.2,4.7,3.0,9.5,4.5,5.4,3.0,13.6,8.8,6.6,2.5,5.9,2.9,7.3,4.1,9.1,3.3,9.5,4.4,8.7,4.4,5.3,2.4,9.7,4.3,1.0,1.5,2.9,1.4,1.6,1.7,4.3,2.9,3.8,2.0,2.1,1.9,5.5,4.3,2.6,1.7,3.6,2.7,1.5,1.8,1.7,1.1,1.6,1.7,1.9,2.3,0.4,0.6,0.7,1.2,0.0,2.7,2.6,1.8,2.1,2.0,3.1,2.6,0.2,0.3,0.5,0.7,0.0,2.7,8.1,5.4,1.5,1.8,14.7,9.5,53.1,6.0,54.9,5.5,51.3,11.9,95.0,2.4,95.0,3.2,95.1,3.3,94.8,2.5,94.5,3.4,95.1,3.3,16.8,3.0,19.3,5.1,14.2,5.2,12.9,2.7,12.6,4.6,13.3,5.0,11.4,2.5,9.6,3.6,13.3,5.0,4.7,1.9,5.9,3.4,3.4,2.3,40.5,2.7,41.0,2.0,39.3,10.5,100.6,29.2,(X),(X),(X),(X),19.9,5.0,(X),(X),(X),(X),13.7,3.4,(X),(X),(X),(X),6.2,3.2,(X),(X),(X),(X),0.0,(X),(X),(X),(X),(X),0.0,(X),(X),(X),(X),(X)
1400000US06073000700,06073000700,"Census Tract 7, San Diego County, California",3791,324,2168,274,1623,226,2.8,1.8,4.2,2.3,1.0,1.6,1.9,1.0,0.5,0.9,3.7,2.0,2.1,1.2,1.2,1.4,3.1,1.8,0.7,0.9,0.6,1.0,0.9,1.4,7.9,3.9,11.3,6.8,3.4,2.6,14.6,4.8,12.7,6.6,17.2,6.9,16.6,4.4,12.4,5.0,22.1,7.9,10.5,4.6,11.6,5.3,9.1,5.5,7.5,3.0,11.3,4.4,2.3,2.4,7.3,2.8,7.9,4.5,6.5,3.3,3.4,1.9,5.9,3.3,0.0,2.4,6.8,3.3,8.3,4.9,4.7,3.6,4.0,2.0,3.8,3.0,4.3,3.6,2.2,1.2,2.0,1.9,2.4,2.6,1.5,1.3,0.8,1.3,2.4,2.7,3.7,2.2,1.8,1.7,6.2,4.5,0.8,0.7,0.7,1.1,1.0,1.7,5.8,3.1,2.8,3.3,9.7,5.0,3.9,1.9,1.8,1.8,6.8,3.4,0.7,0.9,0.6,1.0,0.9,1.4,7.9,3.9,11.3,6.8,3.4,2.6,57.8,5.5,60.0,7.9,55.0,7.8,93.2,1.9,94.0,2.7,92.2,3.7,92.5,1.8,93.4,2.9,91.3,3.9,17.9,3.3,11.9,5.2,26.0,6.6,16.7,3.4,11.9,5.2,23.2,6.0,13.9,2.8,8.1,4.4,21.7,6.0,10.3,3.1,5.3,3.8,16.9,5.7,37.4,2.5,39.3,3.0,34.5,4.1,133.6,27.3,(X),(X),(X),(X),27.3,5.1,(X),(X),(X),(X),17.7,4.1,(X),(X),(X),(X),9.5,2.5,(X),(X),(X),(X),0.0,(X),(X),(X),(X),(X),2.9,(X),(X),(X),(X),(X)
1400000US06073000800,06073000800,"Census Tract 8, San Diego County, California",4156,363,2437,259,1719,288,2.1,1.9,3.0,3.1,0.8,1.2,0.2,0.4,0.0,1.6,0.5,0.9,2.6,1.6,1.8,2.0,3.8,3.7,2.7,1.3,3.6,2.2,1.5,2.3,8.2,3.2,7.6,4.3,9.1,4.4,12.2,4.6,9.7,5.2,15.8,6.5,11.7,5.2,10.7,6.6,13.2,7.0,9.2,2.8,13.4,5.0,3.1,2.9,5.3,2.0,5.0,2.9,5.8,3.4,11.3,4.3,10.3,4.8,12.6,7.5,9.4,3.5,9.2,3.1,9.7,6.3,5.1,2.7,6.0,2.9,3.8,4.4,6.6,3.1,7.0,3.8,6.1,4.8,3.4,1.8,4.9,3.0,1.3,2.2,2.3,1.5,2.5,1.8,1.9,2.2,3.5,2.2,2.0,1.8,5.7,4.0,3.2,1.7,3.1,2.3,3.3,3.0,0.9,1.0,0.0,1.6,2.1,2.4,2.9,1.6,1.8,2.0,4.3,3.8,1.9,1.2,3.2,2.1,0.0,2.3,9.0,3.7,8.0,4.3,10.5,5.0,49.4,4.2,50.1,5.6,48.5,7.2,95.0,1.9,95.1,3.4,94.9,4.0,93.1,2.3,91.9,3.1,94.9,4.0,19.9,3.2,19.5,4.6,20.5,7.4,17.1,2.7,16.2,4.3,18.2,7.2,13.3,2.9,12.6,4.2,14.4,5.8,7.6,2.7,5.1,3.0,11.1,5.1,41.8,5.9,40.2,5.7,42.5,8.1,141.8,30.1,(X),(X),(X),(X),25.3,4.5,(X),(X),(X),(X),16.7,4.0,(X),(X),(X),(X),8.6,3.1,(X),(X),(X),(X),1.1,(X),(X),(X),(X),(X),0.7,(X),(X),(X),(X),(X)
